{
  "$schema": "../../icon.contract.schema.json",
  "schemaVersion": "1",
  "name": "circle",
  "displayName": "Circle",
  "namespace": "fsds.icon",
  "description": "Plain circle outline for markers, bullets, and unselected states.",
  "category": "shape",
  "tags": ["circle", "shape", "marker", "bullet", "icon"],
  "aliases": ["ring"],
  "status": "active",
  "updatedAt": "2026-07-09",
  "semantics": {
    "decorativeDefault": true,
    "requiresLabelWhenStandalone": true
  },
  "rtl": {
    "mirrors": false,
    "strategy": "none"
  },
  "variants": {
    "16": {
      "name": "circle-16",
      "description": "Circle outline authored on the 16px grid.",
      "width": 16,
      "height": 16,
      "viewBox": "0 0 16 16",
      "paths": [
        {
          "d": "M8 2.5A5.5 5.5 0 1 1 8 13.5A5.5 5.5 0 1 1 8 2.5",
          "fill": "none",
          "stroke": "currentColor",
          "strokeWidth": 1.5,
          "strokeLineCap": "round"
        }
      ],
      "platformNames": {
        "web": "icon-circle-16",
        "android": "ui_ic_circle_16dp",
        "ios": "circle-16",
        "react": "CircleIcon",
        "svelte": "CircleIcon",
        "reactNative": "CircleIcon",
        "swift": "CircleIcon",
        "kotlin": "CircleIcon"
      }
    },
    "24": {
      "name": "circle-24",
      "description": "Circle outline authored on the 24px grid.",
      "width": 24,
      "height": 24,
      "viewBox": "0 0 24 24",
      "paths": [
        {
          "d": "M12 3.5A8.5 8.5 0 1 1 12 20.5A8.5 8.5 0 1 1 12 3.5",
          "fill": "none",
          "stroke": "currentColor",
          "strokeWidth": 1.5,
          "strokeLineCap": "round"
        }
      ],
      "platformNames": {
        "web": "icon-circle-24",
        "android": "ui_ic_circle_24dp",
        "ios": "circle-24",
        "react": "CircleIcon",
        "svelte": "CircleIcon",
        "reactNative": "CircleIcon",
        "swift": "CircleIcon",
        "kotlin": "CircleIcon"
      }
    }
  },
  "relatedIcons": ["check"],
  "provenance": {
    "source": "repo-authored",
    "license": "repo-owned",
    "notes": "Hand-authored for ICON-CATALOG-RUNTIME-DELIVERY-01."
  }
}
