{
  "$schema": "../../icon.contract.schema.json",
  "schemaVersion": "1",
  "name": "panel-left",
  "displayName": "Panel Left",
  "namespace": "fsds.icon",
  "description": "Left sidebar panel for layout toggles and navigation drawers.",
  "category": "navigation",
  "tags": ["panel", "sidebar", "left", "layout", "icon"],
  "aliases": ["sidebar-left"],
  "status": "active",
  "updatedAt": "2026-07-09",
  "semantics": { "decorativeDefault": true, "requiresLabelWhenStandalone": true },
  "rtl": { "mirrors": true, "strategy": "transform" },
  "variants": {
    "16": {
      "name": "panel-left-16",
      "description": "Panel Left authored on the 16px grid.",
      "width": 16,
      "height": 16,
      "viewBox": "0 0 16 16",
      "paths": [
        { "d": "M3.5 3H12.5A1.5 1.5 0 0 1 14 4.5V11.5A1.5 1.5 0 0 1 12.5 13H3.5A1.5 1.5 0 0 1 2 11.5V4.5A1.5 1.5 0 0 1 3.5 3Z", "fill": "none", "stroke": "currentColor", "strokeWidth": 1.5, "strokeLineJoin": "round" },
        { "d": "M6 3V13", "fill": "none", "stroke": "currentColor", "strokeWidth": 1.5 }
      ],
      "platformNames": { "web": "icon-panel-left-16", "android": "ui_ic_panel_left_16dp", "ios": "panel-left-16", "react": "PanelLeftIcon", "svelte": "PanelLeftIcon", "reactNative": "PanelLeftIcon", "swift": "PanelLeftIcon", "kotlin": "PanelLeftIcon" }
    },
    "24": {
      "name": "panel-left-24",
      "description": "Panel Left authored on the 24px grid.",
      "width": 24,
      "height": 24,
      "viewBox": "0 0 24 24",
      "paths": [
        { "d": "M5.5 4H18.5A2.5 2.5 0 0 1 21 6.5V17.5A2.5 2.5 0 0 1 18.5 20H5.5A2.5 2.5 0 0 1 3 17.5V6.5A2.5 2.5 0 0 1 5.5 4Z", "fill": "none", "stroke": "currentColor", "strokeWidth": 1.5, "strokeLineJoin": "round" },
        { "d": "M9 4V20", "fill": "none", "stroke": "currentColor", "strokeWidth": 1.5 }
      ],
      "platformNames": { "web": "icon-panel-left-24", "android": "ui_ic_panel_left_24dp", "ios": "panel-left-24", "react": "PanelLeftIcon", "svelte": "PanelLeftIcon", "reactNative": "PanelLeftIcon", "swift": "PanelLeftIcon", "kotlin": "PanelLeftIcon" }
    }
  },
  "relatedIcons": ["panel-right"],
  "provenance": { "source": "repo-authored", "license": "repo-owned", "notes": "Hand-authored for the navigation/layout iconography slice." }
}
