{
  "$schema": "../../icon.contract.schema.json",
  "schemaVersion": "1",
  "name": "home",
  "displayName": "Home",
  "namespace": "fsds.icon",
  "description": "House shape for home navigation and dashboard entries.",
  "category": "navigation",
  "tags": [
    "home",
    "house",
    "dashboard",
    "start",
    "icon"
  ],
  "aliases": [],
  "status": "active",
  "updatedAt": "2026-07-09",
  "semantics": {
    "decorativeDefault": true,
    "requiresLabelWhenStandalone": true
  },
  "rtl": {
    "mirrors": false,
    "strategy": "none"
  },
  "variants": {
    "16": {
      "name": "home-16",
      "description": "Home authored on the 16px grid.",
      "width": 16,
      "height": 16,
      "viewBox": "0 0 16 16",
      "paths": [
        {
          "d": "M3 7.5L8 3L13 7.5V13H9.5V9.5H6.5V13H3V7.5Z",
          "fill": "none",
          "stroke": "currentColor",
          "strokeWidth": 1.5,
          "strokeLineCap": "round",
          "strokeLineJoin": "round"
        }
      ],
      "platformNames": {
        "web": "icon-home-16",
        "android": "ui_ic_home_16dp",
        "ios": "home-16",
        "react": "HomeIcon",
        "svelte": "HomeIcon",
        "reactNative": "HomeIcon",
        "swift": "HomeIcon",
        "kotlin": "HomeIcon"
      }
    },
    "24": {
      "name": "home-24",
      "description": "Home authored on the 24px grid.",
      "width": 24,
      "height": 24,
      "viewBox": "0 0 24 24",
      "paths": [
        {
          "d": "M4.5 11L12 4.5L19.5 11V19.5H14.5V14.5H9.5V19.5H4.5V11Z",
          "fill": "none",
          "stroke": "currentColor",
          "strokeWidth": 1.5,
          "strokeLineCap": "round",
          "strokeLineJoin": "round"
        }
      ],
      "platformNames": {
        "web": "icon-home-24",
        "android": "ui_ic_home_24dp",
        "ios": "home-24",
        "react": "HomeIcon",
        "svelte": "HomeIcon",
        "reactNative": "HomeIcon",
        "swift": "HomeIcon",
        "kotlin": "HomeIcon"
      }
    }
  },
  "relatedIcons": [],
  "provenance": {
    "source": "repo-authored",
    "license": "repo-owned",
    "notes": "Hand-authored for ICON-CATALOG-RUNTIME-DELIVERY-01 — first real icon batch, healing pre-existing usage-sidecar references."
  }
}
