{
  "$schema": "../../icon.contract.schema.json",
  "schemaVersion": "1",
  "name": "search",
  "displayName": "Search",
  "namespace": "fsds.icon",
  "description": "Magnifying glass for search inputs and command palettes.",
  "category": "action",
  "tags": [
    "search",
    "find",
    "magnifier",
    "lookup",
    "icon"
  ],
  "aliases": [
    "magnifying-glass"
  ],
  "status": "active",
  "updatedAt": "2026-07-09",
  "semantics": {
    "decorativeDefault": true,
    "requiresLabelWhenStandalone": true
  },
  "rtl": {
    "mirrors": false,
    "strategy": "none"
  },
  "variants": {
    "16": {
      "name": "search-16",
      "description": "Search authored on the 16px grid.",
      "width": 16,
      "height": 16,
      "viewBox": "0 0 16 16",
      "paths": [
        {
          "d": "M7 3A4 4 0 1 1 7 11A4 4 0 1 1 7 3",
          "fill": "none",
          "stroke": "currentColor",
          "strokeWidth": 1.5,
          "strokeLineCap": "round",
          "strokeLineJoin": "round"
        },
        {
          "d": "M10 10L13.5 13.5",
          "fill": "none",
          "stroke": "currentColor",
          "strokeWidth": 1.5,
          "strokeLineCap": "round",
          "strokeLineJoin": "round"
        }
      ],
      "platformNames": {
        "web": "icon-search-16",
        "android": "ui_ic_search_16dp",
        "ios": "search-16",
        "react": "SearchIcon",
        "svelte": "SearchIcon",
        "reactNative": "SearchIcon",
        "swift": "SearchIcon",
        "kotlin": "SearchIcon"
      }
    },
    "24": {
      "name": "search-24",
      "description": "Search authored on the 24px grid.",
      "width": 24,
      "height": 24,
      "viewBox": "0 0 24 24",
      "paths": [
        {
          "d": "M10.5 4.5A6 6 0 1 1 10.5 16.5A6 6 0 1 1 10.5 4.5",
          "fill": "none",
          "stroke": "currentColor",
          "strokeWidth": 1.5,
          "strokeLineCap": "round",
          "strokeLineJoin": "round"
        },
        {
          "d": "M15 15L19.5 19.5",
          "fill": "none",
          "stroke": "currentColor",
          "strokeWidth": 1.5,
          "strokeLineCap": "round",
          "strokeLineJoin": "round"
        }
      ],
      "platformNames": {
        "web": "icon-search-24",
        "android": "ui_ic_search_24dp",
        "ios": "search-24",
        "react": "SearchIcon",
        "svelte": "SearchIcon",
        "reactNative": "SearchIcon",
        "swift": "SearchIcon",
        "kotlin": "SearchIcon"
      }
    }
  },
  "relatedIcons": [],
  "provenance": {
    "source": "repo-authored",
    "license": "repo-owned",
    "notes": "Hand-authored for ICON-CATALOG-RUNTIME-DELIVERY-01 — first real icon batch, healing pre-existing usage-sidecar references."
  }
}
